{
  "schema": "cassandra-index-criteria",
  "schema_version": 1,
  "methodology": "3.0",
  "criteria_count": 46,
  "drivers": [
    {
      "id": "D1",
      "name": {
        "ru": "Д1. Военная активность",
        "en": "D1. Military activity"
      }
    },
    {
      "id": "D2",
      "name": {
        "ru": "Д2. Ядерная сигнальная активность",
        "en": "D2. Nuclear signaling activity"
      }
    },
    {
      "id": "D3",
      "name": {
        "ru": "Д3. Дипломатическая эскалация и деэскалация",
        "en": "D3. Diplomatic escalation and de-escalation"
      }
    },
    {
      "id": "D4",
      "name": {
        "ru": "Д4. Экономические индикаторы конфликта",
        "en": "D4. Economic indicators of conflict"
      }
    },
    {
      "id": "D5",
      "name": {
        "ru": "Д5. Информационная и киберсфера",
        "en": "D5. Information and cyber sphere"
      }
    },
    {
      "id": "D6",
      "name": {
        "ru": "Д6. Мобилизация общества",
        "en": "D6. Societal mobilization"
      }
    },
    {
      "id": "D7",
      "name": {
        "ru": "Д7. Распространение и вовлечение третьих сторон",
        "en": "D7. Proliferation and third-party involvement"
      }
    },
    {
      "id": "D8",
      "name": {
        "ru": "Д8. Подтверждённые деэскалирующие исходы",
        "en": "D8. Confirmed de-escalating outcomes"
      }
    },
    {
      "id": "D9",
      "name": {
        "ru": "Д9. Косвенные индикаторы подготовки",
        "en": "D9. Indirect preparation indicators"
      }
    }
  ],
  "criteria": [
    {
      "id": "D1.1",
      "driver": "D1",
      "scale": "count",
      "dir": "esc",
      "name": {
        "ru": "Перемещения войск и военных колонн",
        "en": "Troop and military column movements"
      },
      "description": {
        "ru": "Наземные переброски, железнодорожные эшелоны и морские перевозки войск вблизи театра военных действий или границ.",
        "en": "Ground transfers, railway echelons and sealifts of troops near the theatre of operations or borders."
      }
    },
    {
      "id": "D1.2",
      "driver": "D1",
      "scale": "ordinal",
      "dir": "esc",
      "name": {
        "ru": "Учения необычного масштаба",
        "en": "Exercises of unusual scale"
      },
      "description": {
        "ru": "Анонсированные и фактические учения, необычные по масштабу, близости к границе или одновременности на нескольких фронтах.",
        "en": "Announced and actual exercises unusual in scale, proximity to borders, or simultaneity across several fronts."
      }
    },
    {
      "id": "D1.3",
      "driver": "D1",
      "scale": "ordinal",
      "dir": "esc",
      "name": {
        "ru": "Наращивание военной логистики",
        "en": "Military logistics build-up"
      },
      "description": {
        "ru": "Склады боеприпасов, топливные резервы, развёртывание полевых госпиталей, мостов и переправ.",
        "en": "Ammunition depots, fuel reserves, and deployment of field hospitals, bridges and crossings."
      }
    },
    {
      "id": "D1.4",
      "driver": "D1",
      "scale": "count",
      "dir": "esc",
      "name": {
        "ru": "Актуальные боевые действия",
        "en": "Active hostilities"
      },
      "description": {
        "ru": "Обстрелы, авиаудары, пограничные инциденты и попытки прорыва; вторжение или открытие нового театра учитываются как наиболее тяжёлые события.",
        "en": "Shelling, airstrikes, border incidents and breakthrough attempts; an invasion or a new theatre counts among the most severe events."
      }
    },
    {
      "id": "D1.5",
      "driver": "D1",
      "scale": "ordinal",
      "dir": "esc",
      "name": {
        "ru": "Развёртывание стратегических систем",
        "en": "Deployment of strategic systems"
      },
      "description": {
        "ru": "Переброска ПВО, надводных групп, подводных сил и ядерной инфраструктуры; ядерная риторика учитывается отдельным драйвером.",
        "en": "Deployment of air defence, surface groups, submarines and nuclear infrastructure; nuclear rhetoric is tracked by a separate driver."
      }
    },
    {
      "id": "D1.6",
      "driver": "D1",
      "scale": "ordinal",
      "dir": "deesc",
      "name": {
        "ru": "Разведение сил",
        "en": "Drawdown of forces"
      },
      "description": {
        "ru": "Подтверждённое разведение войск, вывод из позиций и сокращение активности.",
        "en": "Confirmed troop drawdowns, withdrawal from positions and reduced activity."
      }
    },
    {
      "id": "D2.1",
      "driver": "D2",
      "scale": "ordinal",
      "dir": "esc",
      "name": {
        "ru": "Публичные ядерные угрозы",
        "en": "Public nuclear threats"
      },
      "description": {
        "ru": "Явные заявления о применении ядерного оружия на уровне глав государств и министров обороны или иностранных дел.",
        "en": "Explicit statements about nuclear weapons use by heads of state and ministers of defence or foreign affairs."
      }
    },
    {
      "id": "D2.2",
      "driver": "D2",
      "scale": "binary",
      "dir": "esc",
      "name": {
        "ru": "Смена доктрины и договоров",
        "en": "Doctrine and treaty shifts"
      },
      "description": {
        "ru": "Изменения ядерной доктрины, выход из договоров по контролю над вооружениями, приостановка участия в механизмах уведомления.",
        "en": "Changes to nuclear doctrine, withdrawal from arms-control treaties, suspension of notification mechanisms."
      }
    },
    {
      "id": "D2.3",
      "driver": "D2",
      "scale": "count",
      "dir": "esc",
      "name": {
        "ru": "Технические ядерные сигналы",
        "en": "Technical nuclear signals"
      },
      "description": {
        "ru": "Учения стратегических сил, подвижки ракетных комплексов, подготовка полигонов, смена режима дежурств.",
        "en": "Strategic force exercises, movements of missile systems, test-site preparations, changes in duty rotations."
      }
    },
    {
      "id": "D2.4",
      "driver": "D2",
      "scale": "binary",
      "dir": "esc",
      "name": {
        "ru": "Повышение готовности ядерных сил",
        "en": "Raised nuclear readiness"
      },
      "description": {
        "ru": "Публичные заявления о переводе ядерных сил на особый режим.",
        "en": "Public announcements of moving nuclear forces to a special readiness regime."
      }
    },
    {
      "id": "D2.5",
      "driver": "D2",
      "scale": "binary",
      "dir": "deesc",
      "name": {
        "ru": "Отход от ядерной риторики",
        "en": "Step back from nuclear rhetoric"
      },
      "description": {
        "ru": "Отказ от ядерных угроз, подтверждённое возвращение сил к штатному режиму, восстановление договорных механизмов.",
        "en": "Renunciation of nuclear threats, confirmed return of forces to normal posture, restoration of treaty mechanisms."
      }
    },
    {
      "id": "D3.1",
      "driver": "D3",
      "scale": "count",
      "dir": "esc",
      "name": {
        "ru": "Разрыв дипломатических отношений",
        "en": "Breakdown of diplomatic relations"
      },
      "description": {
        "ru": "Разрыв или понижение отношений, массовая высылка дипломатов, закрытие посольств.",
        "en": "Rupture or downgrading of relations, mass expulsions of diplomats, embassy closures."
      }
    },
    {
      "id": "D3.2",
      "driver": "D3",
      "scale": "ordinal",
      "dir": "esc",
      "name": {
        "ru": "Ультиматумы",
        "en": "Ultimatums"
      },
      "description": {
        "ru": "Публично заявленные несовместимые требования сторон конфликта.",
        "en": "Publicly stated incompatible demands by the parties to the conflict."
      }
    },
    {
      "id": "D3.3",
      "driver": "D3",
      "scale": "count",
      "dir": "esc",
      "name": {
        "ru": "Санкции и международно-правовые решения",
        "en": "Sanctions and legal measures"
      },
      "description": {
        "ru": "Новые пакеты санкций, резолюции, признание сторон конфликта террористическими и подобные решения.",
        "en": "New sanctions packages, resolutions, designations of parties as terrorist and similar measures."
      }
    },
    {
      "id": "D3.4",
      "driver": "D3",
      "scale": "ordinal",
      "dir": "deesc",
      "name": {
        "ru": "Переговоры и посредничество",
        "en": "Talks and mediation"
      },
      "description": {
        "ru": "Возобновление или запуск переговоров, посредничество третьих стран и организаций.",
        "en": "Resumption or launch of negotiations, mediation by third countries and organisations."
      }
    },
    {
      "id": "D3.5",
      "driver": "D3",
      "scale": "count",
      "dir": "deesc",
      "name": {
        "ru": "Гуманитарные договорённости",
        "en": "Humanitarian arrangements"
      },
      "description": {
        "ru": "Договорённости о коридорах, обменах пленными и доступе инспекций.",
        "en": "Arrangements on corridors, prisoner exchanges and inspection access."
      }
    },
    {
      "id": "D4.1",
      "driver": "D4",
      "scale": "count",
      "dir": "esc",
      "name": {
        "ru": "Новые санкции и контрсанкции",
        "en": "New sanctions and countersanctions"
      },
      "description": {
        "ru": "Ограничения на экспорт энергоносителей и критичных товаров; само решение об ограничениях учитывается дипломатическим драйвером.",
        "en": "Restrictions on exports of energy and critical goods; the decision itself is tracked by the diplomatic driver."
      }
    },
    {
      "id": "D4.2",
      "driver": "D4",
      "scale": "ordinal",
      "dir": "esc",
      "name": {
        "ru": "Военные расходы",
        "en": "Military spending"
      },
      "description": {
        "ru": "Экстренные бюджетные ассигнования и переход экономики на военные рельсы по открытым бюджетам и официальным решениям.",